[
  {
    "id": "con_0001",
    "contractNo": "GW-C-2026-001",
    "quoteId": "quo_0002",
    "customerId": "cus_0001",
    "buildingId": "bld_0001",
    "divisionId": "fire",
    "startDate": "2026-03-19",
    "endDate": "2027-03-18",
    "annualAmount": 3826900,
    "status": "active",
    "createdAt": "2026-03-15T01:00:00.000Z"
  },
  {
    "id": "con_0002",
    "contractNo": "GW-C-2026-002",
    "quoteId": "quo_0006",
    "customerId": "cus_0017",
    "buildingId": "bld_0029",
    "divisionId": "fire",
    "startDate": "2026-03-24",
    "endDate": "2027-03-23",
    "annualAmount": 2736800,
    "status": "active",
    "createdAt": "2026-03-20T01:00:00.000Z"
  },
  {
    "id": "con_0003",
    "contractNo": "GW-C-2026-003",
    "quoteId": "quo_0007",
    "customerId": "cus_0002",
    "buildingId": "bld_0003",
    "divisionId": "fire",
    "startDate": "2026-03-25",
    "endDate": "2027-03-24",
    "annualAmount": 1196800,
    "status": "active",
    "createdAt": "2026-03-21T01:00:00.000Z"
  },
  {
    "id": "con_0004",
    "contractNo": "GW-C-2026-004",
    "quoteId": "quo_0008",
    "customerId": "cus_0011",
    "buildingId": "bld_0021",
    "divisionId": "fire",
    "startDate": "2026-04-04",
    "endDate": "2027-04-03",
    "annualAmount": 1644500,
    "status": "active",
    "createdAt": "2026-03-31T01:00:00.000Z"
  },
  {
    "id": "con_0005",
    "contractNo": "GW-C-2026-005",
    "quoteId": "quo_0011",
    "customerId": "cus_0006",
    "buildingId": "bld_0011",
    "divisionId": "fire",
    "startDate": "2026-04-27",
    "endDate": "2027-04-26",
    "annualAmount": 2239600,
    "status": "active",
    "createdAt": "2026-04-23T01:00:00.000Z"
  },
  {
    "id": "con_0006",
    "contractNo": "GW-C-2026-006",
    "quoteId": "quo_0013",
    "customerId": "cus_0022",
    "buildingId": "bld_0034",
    "divisionId": "fire",
    "startDate": "2026-05-04",
    "endDate": "2027-05-03",
    "annualAmount": 3700400,
    "status": "active",
    "createdAt": "2026-04-30T01:00:00.000Z"
  },
  {
    "id": "con_0007",
    "contractNo": "GW-C-2026-007",
    "quoteId": "quo_0014",
    "customerId": "cus_0006",
    "buildingId": "bld_0012",
    "divisionId": "fire",
    "startDate": "2026-05-07",
    "endDate": "2027-05-06",
    "annualAmount": 1524600,
    "status": "active",
    "createdAt": "2026-05-03T01:00:00.000Z"
  },
  {
    "id": "con_0008",
    "contractNo": "GW-C-2026-008",
    "quoteId": "quo_0015",
    "customerId": "cus_0021",
    "buildingId": "bld_0033",
    "divisionId": "fire",
    "startDate": "2026-05-07",
    "endDate": "2027-05-06",
    "annualAmount": 1016400,
    "status": "active",
    "createdAt": "2026-05-03T01:00:00.000Z"
  },
  {
    "id": "con_0009",
    "contractNo": "GW-C-2026-009",
    "quoteId": "quo_0016",
    "customerId": "cus_0018",
    "buildingId": "bld_0030",
    "divisionId": "fire",
    "startDate": "2026-05-10",
    "endDate": "2027-05-09",
    "annualAmount": 1196800,
    "status": "active",
    "createdAt": "2026-05-06T01:00:00.000Z"
  },
  {
    "id": "con_0010",
    "contractNo": "GW-C-2026-010",
    "quoteId": "quo_0023",
    "customerId": "cus_0001",
    "buildingId": "bld_0002",
    "divisionId": "fire",
    "startDate": "2026-05-24",
    "endDate": "2027-05-23",
    "annualAmount": 829400,
    "status": "active",
    "createdAt": "2026-05-20T01:00:00.000Z"
  },
  {
    "id": "con_0011",
    "contractNo": "GW-C-2026-011",
    "quoteId": "quo_0025",
    "customerId": "cus_0005",
    "buildingId": "bld_0010",
    "divisionId": "fire",
    "startDate": "2026-05-25",
    "endDate": "2027-05-24",
    "annualAmount": 972400,
    "status": "active",
    "createdAt": "2026-05-21T01:00:00.000Z"
  },
  {
    "id": "con_0012",
    "contractNo": "GW-C-2026-012",
    "quoteId": "quo_0027",
    "customerId": "cus_0019",
    "buildingId": "bld_0031",
    "divisionId": "telecom",
    "startDate": "2026-06-04",
    "endDate": "2027-06-03",
    "annualAmount": 1433740,
    "status": "active",
    "createdAt": "2026-05-31T01:00:00.000Z"
  },
  {
    "id": "con_0013",
    "contractNo": "GW-C-2026-013",
    "quoteId": "quo_0030",
    "customerId": "cus_0002",
    "buildingId": "bld_0003",
    "divisionId": "telecom",
    "startDate": "2026-06-10",
    "endDate": "2027-06-09",
    "annualAmount": 858880,
    "status": "active",
    "createdAt": "2026-06-06T01:00:00.000Z"
  },
  {
    "id": "con_0014",
    "contractNo": "GW-C-2026-014",
    "quoteId": "quo_0034",
    "customerId": "cus_0007",
    "buildingId": "bld_0013",
    "divisionId": "fire",
    "startDate": "2026-07-02",
    "endDate": "2027-07-01",
    "annualAmount": 2134000,
    "status": "active",
    "createdAt": "2026-06-28T01:00:00.000Z"
  },
  {
    "id": "con_0015",
    "contractNo": "GW-C-2026-015",
    "quoteId": "quo_0036",
    "customerId": "cus_0023",
    "buildingId": "bld_0035",
    "divisionId": "telecom",
    "startDate": "2026-07-05",
    "endDate": "2027-07-04",
    "annualAmount": 898480,
    "status": "active",
    "createdAt": "2026-07-01T01:00:00.000Z"
  },
  {
    "id": "con_0016",
    "contractNo": "GW-C-2026-016",
    "quoteId": "quo_0037",
    "customerId": "cus_0004",
    "buildingId": "bld_0007",
    "divisionId": "fire",
    "startDate": "2026-07-07",
    "endDate": "2027-07-06",
    "annualAmount": 4854300,
    "status": "active",
    "createdAt": "2026-07-03T01:00:00.000Z"
  },
  {
    "id": "con_0017",
    "contractNo": "GW-C-2026-017",
    "quoteId": "quo_0038",
    "customerId": "cus_0021",
    "buildingId": "bld_0033",
    "divisionId": "fire",
    "startDate": "2026-07-07",
    "endDate": "2027-07-06",
    "annualAmount": 1599400,
    "status": "active",
    "createdAt": "2026-07-03T01:00:00.000Z"
  },
  {
    "id": "con_0018",
    "contractNo": "GW-C-2026-018",
    "quoteId": "quo_0041",
    "customerId": "cus_0005",
    "buildingId": "bld_0009",
    "divisionId": "telecom",
    "startDate": "2026-07-16",
    "endDate": "2027-07-15",
    "annualAmount": 1304160,
    "status": "active",
    "createdAt": "2026-07-12T01:00:00.000Z"
  },
  {
    "id": "con_0019",
    "contractNo": "GW-C-2026-019",
    "quoteId": "quo_0042",
    "customerId": "cus_0005",
    "buildingId": "bld_0010",
    "divisionId": "fire",
    "startDate": "2026-07-22",
    "endDate": "2027-07-21",
    "annualAmount": 1555400,
    "status": "active",
    "createdAt": "2026-07-18T01:00:00.000Z"
  },
  {
    "id": "con_0020",
    "contractNo": "GW-C-2026-020",
    "quoteId": "quo_0044",
    "customerId": "cus_0001",
    "buildingId": "bld_0001",
    "divisionId": "mechanical",
    "startDate": "2026-07-22",
    "endDate": "2027-07-21",
    "annualAmount": 5749700,
    "status": "active",
    "createdAt": "2026-07-18T01:00:00.000Z"
  },
  {
    "id": "con_0021",
    "contractNo": "GW-C-2026-021",
    "quoteId": "quo_0045",
    "customerId": "cus_0004",
    "buildingId": "bld_0007",
    "divisionId": "telecom",
    "startDate": "2026-07-23",
    "endDate": "2027-07-22",
    "annualAmount": 3875080,
    "status": "active",
    "createdAt": "2026-07-19T01:00:00.000Z"
  },
  {
    "id": "con_0022",
    "contractNo": "GW-C-2026-022",
    "quoteId": "quo_0055",
    "customerId": "cus_0023",
    "buildingId": "bld_0035",
    "divisionId": "telecom",
    "startDate": "2026-08-08",
    "endDate": "2027-08-07",
    "annualAmount": 4034800,
    "status": "active",
    "createdAt": "2026-08-04T01:00:00.000Z"
  },
  {
    "id": "con_0023",
    "contractNo": "GW-C-2026-023",
    "quoteId": "quo_0057",
    "customerId": "cus_0005",
    "buildingId": "bld_0009",
    "divisionId": "telecom",
    "startDate": "2026-08-09",
    "endDate": "2027-08-08",
    "annualAmount": 976360,
    "status": "active",
    "createdAt": "2026-08-05T01:00:00.000Z"
  },
  {
    "id": "con_0024",
    "contractNo": "GW-C-2026-024",
    "quoteId": "quo_0060",
    "customerId": "cus_0007",
    "buildingId": "bld_0013",
    "divisionId": "fire",
    "startDate": "2026-08-20",
    "endDate": "2027-08-19",
    "annualAmount": 3414400,
    "status": "active",
    "createdAt": "2026-08-16T01:00:00.000Z"
  },
  {
    "id": "con_0025",
    "contractNo": "GW-C-2026-025",
    "quoteId": "quo_0062",
    "customerId": "cus_0011",
    "buildingId": "bld_0021",
    "divisionId": "telecom",
    "startDate": "2026-08-24",
    "endDate": "2027-08-23",
    "annualAmount": 3262600,
    "status": "active",
    "createdAt": "2026-08-20T01:00:00.000Z"
  },
  {
    "id": "con_0026",
    "contractNo": "GW-C-2026-026",
    "quoteId": "quo_0063",
    "customerId": "cus_0018",
    "buildingId": "bld_0030",
    "divisionId": "fire",
    "startDate": "2026-08-26",
    "endDate": "2027-08-25",
    "annualAmount": 1196800,
    "status": "active",
    "createdAt": "2026-08-22T01:00:00.000Z"
  },
  {
    "id": "con_0027",
    "contractNo": "GW-C-2026-027",
    "quoteId": "quo_0065",
    "customerId": "cus_0005",
    "buildingId": "bld_0010",
    "divisionId": "fire",
    "startDate": "2026-08-31",
    "endDate": "2027-08-30",
    "annualAmount": 1555400,
    "status": "active",
    "createdAt": "2026-08-27T01:00:00.000Z"
  },
  {
    "id": "con_0028",
    "contractNo": "GW-C-2026-028",
    "quoteId": "quo_0068",
    "customerId": "cus_0022",
    "buildingId": "bld_0034",
    "divisionId": "fire",
    "startDate": "2026-09-05",
    "endDate": "2027-09-04",
    "annualAmount": 3700400,
    "status": "active",
    "createdAt": "2026-09-01T01:00:00.000Z"
  },
  {
    "id": "con_0029",
    "contractNo": "GW-C-2026-029",
    "quoteId": "quo_0070",
    "customerId": "cus_0006",
    "buildingId": "bld_0011",
    "divisionId": "telecom",
    "startDate": "2026-09-07",
    "endDate": "2027-09-06",
    "annualAmount": 909040,
    "status": "active",
    "createdAt": "2026-09-03T01:00:00.000Z"
  },
  {
    "id": "con_0030",
    "contractNo": "GW-C-2026-030",
    "quoteId": "quo_0071",
    "customerId": "cus_0002",
    "buildingId": "bld_0003",
    "divisionId": "fire",
    "startDate": "2026-09-11",